<xs:schema xmlns:xs="http://www.w3.org/2001/XMLSchema" elementFormDefault="qualified">

  <xs:element name="inquiries">
    <xs:complexType>
      <xs:sequence>
        <xs:element name="inquiry" maxOccurs="unbounded">
          <xs:complexType>
            <xs:sequence>
              <xs:element name="name" type="xs:string"/>
              <xs:element name="phone">
                <xs:simpleType>
                  <xs:restriction base="xs:string">
                    <xs:pattern value="5[0-9]{7}"/>
                  </xs:restriction>
                </xs:simpleType>
              </xs:element>
              <xs:element name="email">
                <xs:simpleType>
                  <xs:restriction base="xs:string">
                    <xs:pattern value="[a-zA-Z0-9._%+-]+@[a-zA-Z0-9.-]+\.[a-zA-Z]{2,4}"/>
                  </xs:restriction>
                </xs:simpleType>
              </xs:element>
              <xs:element name="message" type="xs:string"/>
            </xs:sequence>
          </xs:complexType>
        </xs:element>
      </xs:sequence>
    </xs:complexType>
  </xs:element>

</xs:schema>
